wiI7pd,dealership_name,manual_label,review_id
Worst customer service. Total mismangement  in their after sale service deparment & at workshop department. Extreme lack of professionalism did my blunder to buy car from Honda Point DHA Lahore. Suggest all the new customers neither buy new car from them nor get mechanical services from Honda Point.,HONDA Point,,286
"Non cooperative staff, arrogant, poor services.",HONDA Point,,287
Honda dealership,HONDA Point,,288
Worst Customer Service. Dodgy and Cheating Business Practices.,HONDA Point,,289
"Too expensive, good for oil change only they have good quality, honda should give some relaxation to there customers",HONDA Point,,290
not affordable,HONDA Point,,291
"Easy to access the car with 'hands on'  , the staff was gud",HONDA Point,,292
Nice people,HONDA Point,,293
Business point,HONDA Point,,294
A bit slow service but overall it was good,HONDA Point,,295
Good customer services,HONDA Point,,296
It's Honda cars dealer with all kind of facilities.,HONDA Point,,298
"Based on 11yrs of experience, this DS is a scam. From delivering highest number of ??amaged & repaired?·new cars to unsuspecting customers, selling fake locally packaged fluids in the name of HONDA Genuine to selling B quality spares at 20x prices compared to local market, this dealership is a nightmare.

If you call HONDA ATLAS for their opinion, even they don?? recommend Honda Point.

Except couple HONDA certified techs, most labor at this facility, that actually works on your cars, are untrained daily wages labor.

BodyShop does poor cosmetic repairs without proper denting or surface prep, not giving layers enough time to dry and cure.

Pays its employees below minimum wages, no medical insurance. Mechanics suck out toxic fluids like coolants and brake oil with tubes into their mouth & spit it out like it?? still 1875 at HONDA Point.",HONDA Point,,299
Main ty honda e lesan. Just fun,HONDA Point,,300
Huge outlet,HONDA Point,,301
"Mechanical side and Mechanics of Honda Point has always been Brilliant. It's just the reception, billing section and meet and greet part of it which needs a lot of improvement. The non technical staff on the desks is rude, non cooperative and unskilled. Other than that I'm so sure, Honda Point can do much better under the supervision of Mr. Mansoor Mazhar",HONDA Point,,302
"Very high prices for parts and labour
Bekar administration",HONDA Point,,303
Honda point,HONDA Point,,304
"Quality service,  but too much expensive",HONDA Point,,305
"Good location close to Dha, Airport and Cantt.",HONDA Point,,307
I am very much satisfied by the services being provided by Honda Motors. The body and paint shop staff were very cooperative and they know their job They did quality work and The management is appreciated for that Thanks,HONDA Point,,308
Useless sales staff...Very snobby attitude with little knowhow of their own job. Messed up my home address on the file of the car. Smart card had someone else's phone number instead of the one I gave. Wouldn't buy any vehicle from them again. Also their after service is a mess as compared to Toyota (This is coming from a massive Honda fan),HONDA Point,,309
Just on the road not entered even parking,HONDA Point,,310
Convenient location. 3 S service.  Excellent sales staff,HONDA Point,,311
"You have Honda, you should visit Honda point",HONDA Point,,312
Great i like it,HONDA Point,,313
Best Honda 3s dealer in Lahore,HONDA Point,,314
"Very poor customer relation services, prices are very high as compare to quality of work. They even don't deserve a single star",HONDA Point,,315
As compare to Toyota (Walton Motors) they don't offer water or tea while waiting for the service. (Customer Care needs to be managed well),HONDA Point,,317
Very costly services. Mechanical works not recommended,HONDA Point,,318
"Overall experience is fine. Honda Point is expensive in terms of labor charges. They charge for labor separately for each task. For example, if a person is changing oil and you request him to check for spark plugs, company would charge separately for this, although the hood is already opened and all it would take is to unscrew some screws. The labor charges should be reasonable for any task that would not require extra labor effort.",HONDA Point,,319
Not a very helpful setup.,HONDA Point,,320
Honda Point,HONDA Point,,322
"Extremely non cooperative staff at the service center. They do not attend car on the  allocated time given. Moreover My car / Honda City AT is in warranty, had issues from Day 1, of Battery and AC.. Nobody dare to resolve it",HONDA Point,,323
"Shady people there,",HONDA Point,,324
Capable technicians. But beware of the billing staff.,HONDA Point,,325
"Poor air conditioning and pathetic sitting environment for the customer and people who are working there. One Ac for big hall and it was even 1990 model and there isn?? single
Electric fan.
Customer sweats while paying heavy bills.",HONDA Point,,326
Honda Service center,HONDA Point,,327
Honda delears at bhatta chock near aorport,HONDA Point,,328
"Very good facility, mostly courteous staff but pathetic and cumbersome entry and exit processes. Below photo shows long queue of customers waiting to register their car for servicing.",HONDA Point,,329
Bad service.,HONDA Point,,330
Authorized Honda workshop & Showroom,HONDA Point,,331
"On the way , about there",HONDA Point,,332
Had a very bad experience,HONDA Point,,333
"Had got service appointment for early morning. When I reached there at my appointment time, service consultants were not available. After waiting for them, I had then to get in line because several customers had come by then. Had to constantly repeat to get attention but they accommodated me ultimately. After my job request was made, I had to wait because some other car was standing at the appointment service area & my appointment technician was busy attending some vip/senior citizen. The technician was no doubt qualified & soft spoken. Only performed maintenance that was required without charging me unnecessarily. The last surprise was when my card was charged about Rs. 5000 extra because Mr cashier couldn't discern between 4 & 9 written by the service technician. Nevertheless, I was returned the extra charged amount in cash but at the cost of my valuable time.",HONDA Point,,334
Lazy staff and average service.,HONDA Point,,335
Honda hisun is an initiative of suncrop group. Every type of honda cars can be booked or purchased from here.,HONDA Point,,336
Staff was very courteous and attended promptly when I told I had an appointment for my car.,HONDA Point,,337
Loved it. Best service to my Honda City.,HONDA Point,,338
It was good,HONDA Point,,339
It took a lot of hours for the work to be done.,HONDA Point,,340
nice dealership,HONDA Point,,341
The honda center is good place if you have honda cars.they deal costumers nicely you can say they are doctors of cars they have such a good costumer waiting loundge ..nice service but some time they feel lazy but they are good,HONDA Point,,342
Smooth warranty claim process,HONDA Point,,343
"Pleasant environment, friendly staff. Cool customer waiting lounge.",HONDA Point,,344
"Good service, professional staff.",HONDA Point,,345
Abnormally expansive,HONDA Point,,346
"Exceptional service, competent mechanics.",HONDA Point,,347
Service getting poor and poor,HONDA Point,,348
"They are professional but they just do formality in name of 1000, 5000 and 10000 free checkups. Practically they do nothing in these free checkups.
They also try to dodge you if you complain something faulty and to be entertained in warranty.",HONDA Point,,350
Five star Honda workshop.  Experienced staff.,HONDA Point,,351
Best experience with staff.,HONDA Point,,352
Very Humble Staff,HONDA Point,,353
Nice friendly staff and detail information sharing nicely done,HONDA Point,,354
My favorite car showroom,HONDA Point,,355
Work load verses space availble is less. One has to wait for hours and hours. If unluckily clock struck 1 o'clock then one more hour one has to wait to finish lunch break,HONDA Point,,356
They can put more receptionists on the reception though.,HONDA Point,,357
We were here just to replace oil of our car,HONDA Point,,358
Very good showroom,HONDA Point,,359
Quality service,HONDA Point,,360
Service and sale centre for Honda vehicles.,HONDA Point,,361
Poorest service. They are pathetic.,HONDA Point,,362
They provide best car in reasonable price best supporting staff,HONDA Point,,363
My first car experience,HONDA Point,,365
Professional service. Good customer dealings.,HONDA Point,,366
Having veriety of Honda car's models.  And good staff,HONDA Point,,367
Needs lots of improvement in customer service and technical abilities...,HONDA Point,,368
They offer good support for your vehicle,HONDA Point,,369
Lathargic staff like in a bureaucratic organization.,HONDA Point,,370
You can buy new honda cars from here,HONDA Point,,371
Very bad service . No professional attitude from Manager to lower staff,HONDA Point,,372
To much expensive.... trust me no need to visit any honda service point... only shahshka. Local mechanics zindabad!,HONDA Point,,373
The labour at Honda point are not professional ppl.You need to be very vigilant especially if you go there for oil change or even for any check up.,HONDA Point,,375
Poor management,HONDA Point,,376
Staff are not trained well specially mechanic  I face fuel pump problem and they didn't repair then I go to local market and fix from it. Honda fort Lytton road is better then Honda point. Personal opinion.,HONDA Point,,377
"One of the best Honda Dealers in Lahore. Experienced staff. Highly recommended if you are having any variant of Honda because they are well equipped. Earlier I used to bring my car to local service areas as they are cheaper than Honda Service Dealers but they were not good in troubleshooting as good as authorised Honda Dealers.

The staff at Honda Point got proper training from the company and knows the common problem in Honda cars so if you visiting them they know exactly what?? the issue in your vehicle.",HONDA Point,,379
Equiped worshop with good service,HONDA Point,,380
Very bad service,HONDA Point,,381
Excellent Honda 3S dealership. Very professional staff,HONDA Point,,383
Will be pathetic on the free service and always looking to replace parts. Always delays in delivery. Don't offer test drive. Person to fix navigation system is always absent and you have to take it to township.,HONDA Point,,385
Lazy and non cooperative staff. Credit cards are not accepted.,HONDA Point,,386
Good service. They tuned my car in 30 min in a reasonable price,HONDA Point,,388
I don't know about this place coz I just visit here for one time,HONDA Point,,389
Nice  Service,HONDA Point,,390
"Highly unprofessional dealing post booking until delivery .... make u hostage for add-ons and blackmail you with delay in delivery. Even despite the fact that day of delivery is well tied up in advance.
Not at all recommended .... their front desk staff is extremely poor and highly unprofessional.... want to book a car ... find a better Honda outlet in Lahore",HONDA Point,,391
Staff is not that much friendly,HONDA Point,,392
"Unprofessionals, they get your work done from a random guy on the street...",HONDA Point,,393
"As with most Honda outlets, swindllers in gentelmen's clothing",HONDA Point,,394
Reached early so got quick service?? ??,HONDA Point,,395
Good experience...,HONDA Point,,396
"Poor management, parts not available, unfriendly staff",HONDA Point,,397
Very arrogant staff and not helping S well. And very expensive parts and services.,HONDA Point,,398
They msut work on thr customer management ..... Takes too much time to get periodic maintenance done,HONDA Point,,399
"Professional staff, offering sale service and spare parts.",HONDA Point,,400
Very good services,HONDA Point,,401
It was satisfactorily,HONDA Point,,403
Honda show room,HONDA Point,,404
They do good work but take lot of time in documentation. They also charge 2% extra if you are paying from credit card. This is ridiculous.,HONDA Point,,405
Great service but the staff would steal anything that u forget to take out of ur car ... nd best part is that the managers are pretty much ok with this stealing thing since they ask u to take out ur stuff before submitting the vehicle for repair,HONDA Point,,406
Parking was available.,HONDA Point,,407
???????? ??,HONDA Point,,408
"Its Honda Dealership for Automobiles. You get all services under one roof, i.e., from buying new car to service to body work. A great place and with staff that has been trained to work by Honda. Staff is friendly.
Space is crowded and usually wait time is high afternoon usually and very busy on Saturdays. Its recommended if you own a Honda or want to own one.",HONDA Point,,409
New cars and workshop,HONDA Point,,410
Excellent service....,HONDA Point,,411
My favourite place to service my Honda civic 2018,HONDA Point,,413
They have a good team,HONDA Point,,414
"The Good: Conveniently located with ample parking space and well kept office. The staff is pleasant and reasonable communicators. Has an app to schedule a test drive, check status of car delivery.

The Bad: Need to be a little clear upon the delays in receiving the car prior to a customer's arrival. They wash the car before giving it to you so expect a delay of about 2-3 hours especially around Friday break.

The Ugly: Word of caution: Reconfirm your ordered color choice/have it down on formal documentation.
Messed our color choice. However, were told that we would have to cough up extra money (price change due to $$ hike) and wait another month despite it being an error on their part.  Admittedly my brother was double minded about the car choice, however the system had correctly recorded the color choice but were given another color.",HONDA Point,,415
Non professionals,HONDA Point,,416
Big workshop for car service,HONDA Point,,417
I had a wonderful experience . Their professionalism is second to none. I would highly recommend their customer representative Laiba Shahzad for her exceptional customer relationship skills. Their overall management and servicing departing esp are very helpful & detail oriented.,HONDA Point,,418
"Good service, reliable and helpful staff. Ask for Salman Ahmed the advisor.
They do charge 2% extra on credit/debit cards.

ProTip: take appointments on phone, it can get crowded.",HONDA Point,,419
Not visited,HONDA Point,,420
The workshop is good they provide speedy services,HONDA Point,,421
Quite well but they stole engine oil be careful,HONDA Point,,422
I do internship here,HONDA Point,,423
"Good 3S Honda Point, They not deal in Honda Japanese car. Just Pakistan assembled car services available here. Waiting time for customers is pathetic. Some mechanic are in attitude gestures.
Office staff is good.",HONDA Point,,424
Staff is not cooperative,HONDA Point,,425
Always helpful,HONDA Point,,426
Good services as compared to all other honda showroom,HONDA Point,,427
Too crowded.. too small.. too slow.,HONDA Point,,428
Professionals.....,HONDA Point,,429
best in maintainance,HONDA Point,,430
Surpisingly they only provide service for Honda cars from production range in Pakistan. No service available for imported Honda cars.,HONDA Point,,431
Good showroom,HONDA Point,,434
Lack of professionalism.,HONDA Point,,435
Not satisfied,HONDA Point,,436
Eager to sell - but once you have paid - the efficiency level in delivery gets poor.,HONDA Point,,438
Routine maintenance. my car has been very well attended. Fully satisfied.,HONDA Point,,439
Cooperative ???? ??,HONDA Point,,440