wiI7pd,dealership_name,manual_label,review_id
"Wonderful place, great experience.",HONDA Point,1,1
I have a good experience with Honda point because it has reasonable prices and staff was polite,HONDA Point,1,3
Good workshop,HONDA Point,1,5
"Gd gob
Great work
Fast service",HONDA Point,1,6
Satisfactory service. Labour charges are through the roof though.,HONDA Point,1,7
Good service level,HONDA Point,1,8
"Professional and satisfactory service, courteous behavior and reasonable charges",HONDA Point,1,9
Getting very expensive day by day.,HONDA Point,0,10
Service is good but too expensive??,HONDA Point,0,11
Staff working there tries to cheat the customer. They charge extra amount in some way or the other.,HONDA Point,0,12
Good show room,HONDA Point,1,13
Good sale and service center,HONDA Point,1,16
??I bought a car them good people ??,HONDA Point,1,17
Nice to good work ki maker,HONDA Point,1,19
"They do not want to work
Very casual staff
They are boss",HONDA Point,0,20
Pathetic people,HONDA Point,0,21
Khuda bukhsh colony k pass hy airport road to bhatta chowk,HONDA Point,,22
My experience with Honda point Near Airport is to  bad. Their services are worst and lazy. I booked a back bumper  but after a lapse of a fews days my payment has not been paid to Honda Pakistan Limited. As per company policy booking is on first come first serve basis. Due to this delay  of Honda Point company will deliver the vehicle late . Who will be responsible for the delay and if price will increase who will be responsible. I am calling on phone but no one is attending. Pathetic services.I advise every one to book your vehicle on some other Honda showroom. Commitment of Honda pilot is fake.,HONDA Point,,23
My experience with Honda point Near Airport is very bad. Their services are worst. I booked HRV but after lapse of four days my payment has not been paid to Honda Pakistan Limited. As per company policy booking is on first come first serve basis. Due to this delay  of Honda Point company will deliver the vehicle late . Who will be responsible for the delay and if price will increase who will be responsible. I am calling on phone but no one is attending. Pathetic services.I advise every one to book your vehicle on some other Honda showroom. Commitment of Honda pilot is fake.,HONDA Point,,24
Mediocre services .,HONDA Point,0,25
"There estimate is very high and not acceptable, better to work from outside",HONDA Point,0,27
Staff is Good and expirience is good,HONDA Point,1,28
The show room is really nice and the design of showroom Building is also very nice.,HONDA Point,1,29
Absolutely nice experience all are sophisticated well mannered and skilled mechanics/ technicians,HONDA Point,1,30
Honda Point is one of the worst car dealerships you will find in Lahore.Staff is rude and abusive.From sales person to the manager no one takes responsibility. Worst experience ever and its not the first time two times in four years.,HONDA Point,0,31
Quick and courteous,HONDA Point,1,32
Staff need training on professionalism. Abusive language,HONDA Point,0,33
Never expect a service from them. It's like someone gives you pathetic full of arrogance service and the charges you 2 times for that from market rate.,HONDA Point,0,34
"Courteous and supportive staff (based on my experience). Service level has been good so far for my vehicle.

Each visit boosts the trust.",HONDA Point,1,35
Organized and good service center staff is professional part's and accessories prices are on higher side compared with others dealt in genuine part's,HONDA Point,1,36
"I would avoid Honda Point. I went for a oil change. Instead of seeing a customer service staff, I was moved between four different staff members. The whole operation was based in a stuffy, hot and smelly workshop area. I highlighted the issue everyone I met there and they all blamed their management. This shows that the Honda Point is being run by inefficient managers who don't know even the basics of customer service or about the concept of one stop customer service. I will never visit them again but also advise you to research if other Honda dealerships are offering better service.",HONDA Point,0,37
"Aug 10. 5:30.
No proper arrangements for water. There's no drinking glass, I asked multiple time for water glass and no one bothered. Aal they were saying ""larka nahi hay""",HONDA Point,,38
Tax evasion at it's finest,HONDA Point,,41
Better than rest but service is not very fast,HONDA Point,1,42
Good experience....,HONDA Point,1,43
Had my seat covers changed and the experience was great.,HONDA Point,1,45
Good 3S service providers,HONDA Point,1,46
Excellent place for maintenance. Simply says thugs free workshop.,HONDA Point,1,47
Quick service for most of time. Clean workshop. Professional  staff.,HONDA Point,1,49
"Poor service
Unprofessional staff  ???· ??",HONDA Point,0,51
"Have a poor experience with them. They have to issue me a cheque since last 1 year. And they say that it is honda atlas domain. No o e is ready to help. Poor after after sales services.
Still same comments.",HONDA Point,0,52
Improved services and cooperative staff,HONDA Point,1,53
Good services & staff very cooperative,HONDA Point,1,54
Good service,HONDA Point,1,57
Good services but a little expensive.,HONDA Point,1,58
They provide good after sale services...,HONDA Point,1,59
They provide good sevices,HONDA Point,1,60
"All were fine except one guy who was rude with his own colleague.

Regards,
Daniyal Hussain",HONDA Point,1,63
Didn't feel welcomed at all. No one get bothered to ask if I want to get the details on their new cars. Then we eventually ask one person and he helped us like it was one of ther hardest jobs he was doing. Usually salesman at dealership are welcome and active.,HONDA Point,0,64
Just okay service.,HONDA Point,0,65
Normally they provide okay services. But one time they installed defective product and I had to waste my time arguing with the management to get a refund.,HONDA Point,0,66
"I?? new to town and went to this place for periodic maintenance of my car.. because of the pathetic and unprofessional attitude of their staff who receive cars in the service section, I immediately left and went to another Honda dealership..",HONDA Point,0,67
It's always a good experience,HONDA Point,1,68
"Nice place ample of parking, staff is energetic, helpful but they don't have good Choice of a car for sale, heavy own, Honda city delivery after five months on booking.",HONDA Point,1,69
Poor Service...Miscommitments,HONDA Point,0,70
Very good staff,HONDA Point,1,71
Great experience,HONDA Point,1,72
Parts are not available,HONDA Point,0,74
This is the best Honda sale point of lahore..!,HONDA Point,1,75
Good service,HONDA Point,1,76
Expensive and late service,HONDA Point,0,77
Nice infrastructure,HONDA Point,1,78
Efficient service and very cooperative Staff,HONDA Point,1,79
Excellent point to maintain your honda,HONDA Point,1,80
Never book car with them. Worst experience ever.,HONDA Point,0,81
"As compare to Toyota Airport they are very unprofessional.
Staff is always willing for tip.",HONDA Point,0,83
Excellent service experience,HONDA Point,1,84
Staff isn't corporated. Poor managment,HONDA Point,0,85
Friendly staff and good service,HONDA Point,1,86
"The upper management is often misleading there, and doesn't cooperate often. If there is a lot of cars, expect to be waiting around an hour or so. Otherwise, I usually go here for my car's regular checkup and maintenance. The staff and crew are usually the ones that are really helpful.",HONDA Point,0,87
Don't give a proper response. The way it should be. Doing to much black marketing in Cars. Every showroom of 3S do this .,HONDA Point,0,88
poor service,HONDA Point,0,89
Good service,HONDA Point,1,90
cheap management. cheap service.,HONDA Point,0,91
"Worst honda dealer in Lahore. I made a huge mistake of booking from there just because it's close to my home. To any prospective bookers, book from any honda dealer besides honda point, I've faced nothing but issues there. All employees are also junior employees with no authority to properly resolve issues. Their owner is never there to solve any issues. Their salesmen are complete idiots. Due to their lack of intelligence, I still haven't received my honda city even though I booked on the first day of bookings opening.",HONDA Point,0,92
Looks good but staff and customer care needs improvement,HONDA Point,1,93
Bad service,HONDA Point,0,95
Surprised to see the corporate section is very cooperative and friendly,HONDA Point,1,96
Excellent and wonderful,HONDA Point,1,98
Well designed set up,HONDA Point,1,99
"Honda Cars Customer Service center, provides all types of maintenance facilities.",HONDA Point,1,100
Good quality of work but Commitment of time is weak. Agreed on 5days but taken 16days on that work. Staff is cooperative and friendly.,HONDA Point,0,101
"HONDA POINT PVT. LIMITED, SINCE 2006

An authorized 3S Dealer of Honda Atlas Cars (Pakistan) Ltd. in Lahore, Pakistan

We have been aggressively engaged in the auto business and have been awarded various awards over the years. Our partnership with Honda Atlas Cars (Pakistan) Limited is driven by a genuine belief and desire to optimize customer care and cater for the automotive needs of its customers.
The Sales & Marketing department is run by some very experienced sales staff and supported by the latest software. Furthermore, separate staff has been dedicated to cater for corporate needs.
We are equipped with the most technologically advanced, state of the art machinery in the automotive industry and our Parts Department carries only genuine Honda parts. With the assistance of the latest computer analyzing system our trained technicians are focused on maintaining / repairing the customers vehicles at the earliest convenience. Being a service oriented company our main focus is on customer satisfaction and we go to any extent to satisfy them.
Moreover, we give much emphasis on staff training and Honda Atlas Cars (Pakistan) Limited offers comprehensive training facilities to all technicians. Hence the phrase, ""no one knows your Honda better than your Honda Dealer!""",HONDA Point,,102
"Worst service - Do not ever go here and NEVER EVER Leave your car overnight here. You can only utilise them for basic services like Oil change or oil filter change..

They messed up my car (honda civic reborn) steering and fixed it only temporarily while charging 20k+ for it. While car was with them overnight, they must have hit it from bottom somehow (may be dropped from ramp or they took it outside) because the next day the silencer was tilted towards left. They didn?? admit their fault. When I took my car to Walton to see if this can be fixed, they told me your car has been hit from the bottom with large force otherwise this never tilts.",HONDA Point,0,103
"Good place to service your Honda cars. They have all the services... repairs, service, spare parts, painting etc.",HONDA Point,1,106
Great staff,HONDA Point,1,107
I've always been satisfied with their service. My brother and I both own a Honda and have always gone here. Their bodywork guy/denter is amazing.,HONDA Point,1,109
Its a honda service center,HONDA Point,1,110
Lazy staff and very technical service issues like air compressor is out of order and printer is out of order in body and paint shop.,HONDA Point,1,111
"Good place
Mr Mirza in Sales adept is really helpful n cooperative",HONDA Point,1,112
Honda point airport road per Honda civic ki service kerwai engenir bilal se bilal is very co operative boy and have huge knowledge for all Honda cars variant... Allah Pak bless him,HONDA Point,1,113
Poor customer services! Highly expensive spare parts.,HONDA Point,0,114
Services was not good staff was not cooperative lack of technical skill. They are treating like local mechanic,HONDA Point,0,115
No body is interested to deal the customer. The behavior of staff is poor.,HONDA Point,0,117
Prices of services were too High,HONDA Point,0,118
Good service,HONDA Point,1,119
Booked my car let's see there services next,HONDA Point,,120
New honda city launched,HONDA Point,,122
Very expensive and they always asks customers to get parts replaced instead of solving the issues.,HONDA Point,0,123
Co operative staff. Good services,HONDA Point,1,124
Honda services centre,HONDA Point,,125
Fantastic but little bit traffic,HONDA Point,1,127
Nice show room,HONDA Point,1,128
Poor after sales service!,HONDA Point,0,129
After sale service is poor. Staff treat us as we are in typical government office. Lack of ownership and rude behaviour. Sales staff is ok but after sales service is pathetic.,HONDA Point,0,130
Pathetic booking staff. Simply liars. They don't value commitment and customer support. Bunch of third rated class. Government is helping them to loot people.,HONDA Point,0,132
"All payments made , delivery is late in months.
Dirty and irritating behaviour of Honda booking and marketing staff.
No follow up, simply liars .",HONDA Point,0,133
Assallamualaikum.wr bhai is showroom ka contact no kisi k pass tu de dain jo no inhon ne dia hai net per wo band hai .,HONDA Point,0,134
"Ofcourse its company operated, so the services are  good. But still a big room for improvement. E.g. One feel helpless even he/she went for simple oil change. Allotment of pits should be at the initial point. Changes in price must be informed through text. They do send alot of messages regarding their marketing, but change in price of products is never part of it. They charge money on cashless transactions, which is a bad thing. Honda is generating huge profits, it should promote cashless transactions and waive off charges on card payments.",HONDA Point,0,135
Good People & Good Place,HONDA Point,1,136
Too crowded,HONDA Point,0,138
Need to improve customer service,HONDA Point,,139
A bit slow service but still satisfies customers.,HONDA Point,,140
service is pathetic especially when you deal with paint and body department....staff is always handy....lack of commitment....overall experience not upto the mark,HONDA Point,,141
Worst service. I strongly recommend not to book any car from honda. Pathetic experience.,HONDA Point,,142
Generally the staff is good however the process of job cards needs a major overhaul. they still fill the job cards manually even when they have all the information in their software. The tasks that takes 5 minutes could be literally be done under 1 minute.,HONDA Point,,143
Third class service. Staff is so rude. Sales and customer service both struggle. They sell cars anyway that's y no need to bother wiyh quality.,HONDA Point,,144
Expert mechanics on one place for all solutions,HONDA Point,,145
Good place !,HONDA Point,,147
"I m regular customer of Honda point.
Purchase 2nd time new vehicle.
The workshop is very good.. Customer area is cool.
Good place.
Thank you",HONDA Point,,148
Pathetic service and staff thiefs,HONDA Point,,149
Good service. Peace of mind for the people who care less and wish to leave their cars to the professionals,HONDA Point,,150
All is well,HONDA Point,,151
The number given here is going off.,HONDA Point,,152
Just like an ordinary workshop. Selling fake parts in the name of genuine. Too much expensive. Stay away,HONDA Point,,153
Good customer service,HONDA Point,,154
Quick and efficient service for oil change.,HONDA Point,,155
Selling point of Honda Vehicles produced in Pakistan,HONDA Point,,156
Standard 3S showroom,HONDA Point,,157
Tried to contact Honda Point Lahore to seek some information. Dialled every number on their Google list. No response. Not expected.,HONDA Point,,158
Staff is not good and they do not commit any delivery time of car to customers.... customer services is not good!!,HONDA Point,,159
Normal dealing,HONDA Point,,161
Not a very cooperative staff,HONDA Point,,163
The always miscommit...please take care before going to this workshop had a bad experience in terms of commitment,HONDA Point,,165
Good place and worth it,HONDA Point,,166
Good but too expensive,HONDA Point,,167
"Service is poor
Thats why 4.",HONDA Point,,168
Awesome hr handling,HONDA Point,,170
Achi jaga ha Bhai g,HONDA Point,,172
Sameer Bai zanda bad,HONDA Point,,173
The prices are on higher side and the work they do is satisfactory.,HONDA Point,,174
Good customer service..,HONDA Point,,175
"Request to All,
Wrost experience & don't do any business with them.",HONDA Point,,176
Excellent but very expensive,HONDA Point,,177
Poor services of service advisor they dont entertain any vehicle at entrance customers feel like football to complete their vehicle work,HONDA Point,,179
"Unprofessional and uncooperative staff, make sure your aftermarket parts aren't missing and after using services inspect your car thoroughly before leaving as they won't cooperate one bit after you leave the showroom",HONDA Point,,180
"Only showroom, but service is poor",HONDA Point,,181
"Good quick service: Honda city 2017 model they charged 600 rupees for checking the car with computer. 10,000 to 12,000 rupees for general tuning at 40 thousand KM etc) rates are from Nov 2020",HONDA Point,,182
The weakest service in Lahore.,HONDA Point,,183
Things at Honda Point are systematic n in orderly manner.,HONDA Point,,184
Nice thumbs up,HONDA Point,,185
Technical staff is well trained and equipped with right tolls,HONDA Point,,187
Legends ?· ??,HONDA Point,,188
Not worth it. Way too expensive,HONDA Point,,189
Good service for Honda customers but all such company maintenance units charge much higher than open market.,HONDA Point,,190
Lazy and sluggish people.,HONDA Point,,191
Poor customer services,HONDA Point,,193
"Expensive because of GST 16 %.
I recommend buy oil and filter and replace from outside vendor.",HONDA Point,,194
"Over charge
Prices to much high",HONDA Point,,195
No AC for visitors in waiting area.  Poor people,HONDA Point,,196
Price is high of every product even labour charges,HONDA Point,,197
I don't like it,HONDA Point,,198
They use commercial generator and are a nuisance to the neighbors and dump their waste water onto the adjacent plots creating pollution.,HONDA Point,,200
It was great experience. Quite helpful and hustle free environment.,HONDA Point,,201
Good service. Quite expensive though,HONDA Point,,202
Good service,HONDA Point,,203
"Located on main Airport road, Honda point is an excellent sales point. The hall is air-conditioned and hosts cars like City, Civic and BRV models. Sales staff very cooperative and provide all needed information. One feels satisfied when leaving it.",HONDA Point,,204
honda center,HONDA Point,,205
Time consuming place,HONDA Point,,206
Staff is nice and caring but the location is overloaded. Entrance and exit is the same so congestion is obvious. Try to reach at 9.,HONDA Point,,207
Good professional people.,HONDA Point,,208
Car wash service is worse...,HONDA Point,,210
Neat and clean place.A good handling of customers,HONDA Point,,211
Irresponsible behavior of staff,HONDA Point,,212
Very bad  service of management.....,HONDA Point,,213
good service,HONDA Point,,215
Poor service and experience. They are just sitting there to make money. It is better to go to a good mechanic for overall tuning of the car. Poor experience.,HONDA Point,,216
"These days too much hot and humid, there should be proper air exhust, there is exhust fans but not working. Fans are  just symbol only as these are in the area where no one stand it must be in working area. How technicians will perform when there will be too much hot and humid
Technicians are not wearing gloves or other protective thing when they sit inside cars, usually their hands and dress are oily and when they touch or sit inside cars make it dirty",HONDA Point,,217
These are professional fraudulent. They take money and starts miss commitment. I am living in DHA lahore.beware from them.,HONDA Point,,218
Efficient service,HONDA Point,,219
Good service,HONDA Point,,220
Good place for repair and maintenance,HONDA Point,,221
"Beautiful cars, efficient girls sitting on the front desk but extremely sloppy service. No one wears a mask or wears it only on the mouth and not on the nose.
The service used to be excellent but has deteriorated massively. Do not feel like going there again.",HONDA Point,,222
Very poor experience. Lack of competence and service orientation. No control on inventory. Wasted 3 hr.,HONDA Point,,223
Worst experience,HONDA Point,,224
Poor service,HONDA Point,,225
Service and standards are so so.,HONDA Point,,226
Good expert at one place,HONDA Point,,227
Honda is not responding on promo they promised on sale of honda city,HONDA Point,,228
Fast delivery .. overall of after sales experience,HONDA Point,,229
A lot need to be done in terms of customer handling .technical staff was good,HONDA Point,,230
Ma yahan 2008 say ab tak 2020 regular client hun .... Wheel Alignment k ilawa baqi mechanical work bohot asha hai.,HONDA Point,,231
Good one in all Honda points in lahore,HONDA Point,,233
Useful and friendly,HONDA Point,,234
Mere mismanagement. Toyota Airport is much better.,HONDA Point,,236
"Had been their loyal customer since we purchased and maintained our vehicle through this outlet of Honda; year 2012 onwards till 2018.
After sale services are good but the policy makers and owners do not want to take responsibility if the clients wishes are not fulfilled.
They charge extra 2% if anyone wants to pay through credit card while their competitors do not.
They may provide you with expired low quality wiper rubbers while claiming full price of genuine company produced rubber until refused.
They need to be more focused towards client.",HONDA Point,,237
Very expensive in every manner .they use the same parts which is already used in open market .,HONDA Point,,238
The labour is very unprofessional as one of the mechanic opened the spark plug while the engine was very dusty and dusted the engine when the spark plugs were out and pistons were visible which led dust into the enigne which was very unprofessional by them.,HONDA Point,,240
Best Services,HONDA Point,,242
Nice and courteous service staff,HONDA Point,,243
Not good cooperation,HONDA Point,,245
Poor customer service,HONDA Point,,247
Honda car show room located on very very good place. Airport road is very beautiful and busy and Honda point also very beautiful.,HONDA Point,,248
"I had bought a new civic and 2 months later the AC wasn?? working. Went to this showroom and had to deal with the worst experience. The general manager is Not trained to talk to customers. Rude and disrespectful. It?? unfortunate we only have limited options in Pakistan, otherwise would never buy a Honda after this experience. He was quoting me the terms and conditions of the sale, that was his customer service abilities. Buy your car from other dealers like jail road who have better service. These gurys don?? deserve customer loyalty",HONDA Point,,250
Not Good serives,HONDA Point,,251
Technical  team is nice . But Management is worse,HONDA Point,,252
Pathetic. Don't get any service.,HONDA Point,,253
Over priced and bad value for money. Solution to every problem offered is to change the part.,HONDA Point,,254
Good service,HONDA Point,,255
This is near to my home,HONDA Point,,257
Worst Honda Centre ever visited. Illiterate staff and no satisfactory work.,HONDA Point,,258
Went to get camera replaced in warranty. They checked and told me to go to faisal town to get it changed. Very poor service. Disappointing.,HONDA Point,,259
Have huge variety of Honda product,HONDA Point,,260
"Met Sonia Sameer, very friendly and proactive, however car keys were not available as per policy - I could not check car multimedia system or speakers!",HONDA Point,,261
Good service,HONDA Point,,262
Very expensive,HONDA Point,,263
Honda .....,HONDA Point,,264
Poor service kept waiting for 45 minutes and after that they said work can't start now and have to be done tomorrow ....,HONDA Point,,265
Not satisfying,HONDA Point,,266
"Overall good experience according to work and their facility. Good and friendly technical staff.
Charges are double high than any good garage
Office staff needs much improvement.",HONDA Point,,267
It was good,HONDA Point,,268
Not bad but not good either...,HONDA Point,,269
"Have fake policies, hidden charges, very rude with customers, long long long waitings, miss management, works bluff customers for the work not needed. Works are the face of management. Untrained workers, "" KAMCHOOR""",HONDA Point,,270
"Good staff, well behaved workers, satisfactory work but prices are too high as compare to quality of spare parts. They must lower their prices of parts and procedures.",HONDA Point,,271
Very good service.,HONDA Point,,275
Too expensive for regular vehicle maintenance,HONDA Point,,276
Best customer service and fully satisfied with their service mechanics are truly professional,HONDA Point,,277
Let's see as Booker a car  how they will give service,HONDA Point,,278
Fraud people and worst service ever....,HONDA Point,,279
Useless staff. Not interested in customers unless they smell a real deal. They dont like to entertain. Very greedy and money minded management. They dont even care to get up from their seat. All over a very disappointing experience.,HONDA Point,,280
Very good customer service. But still improvements required.,HONDA Point,,281
Pathetic Service,HONDA Point,,282
"This is the worst workshop on the planet, since they have only one honda workshop they dont care if you are satisfied or not.",HONDA Point,,283
Bad name on honda,HONDA Point,,285
